{
    "$schema": "../../../scripts/design-system/contract.schema.json",
    "name": "TextLink",
    "tier": "atom",
    "group": "navigation",
    "status": "beta",
    "description": "Inline text link primitive with a stable focus ring + underline contract. Distinct from `Link` (the design-system Link wrapping `next/link`) — `TextLink` is the unwrapped underline-on-hover token used inside prose.",
    "figma": "https://www.figma.com/design/d8nFs8A5KcjbFr6KkwZV4H5K/Digitaltableteur-Design-System?node-id=dt-text-link",
    "radixPrimitive": null,
    "element": "a",
    "variants": {},
    "slots": [],
    "asChild": false,
    "subParts": [],
    "requiredStories": [
        "Default",
        "Playground",
        "Example",
        "ForcedColors"
    ],
    "a11y": {
        "keyboard": [
            "Tab — focusable in document order.",
            "Enter — activates the link."
        ],
        "ariaRequirements": [
            "Renders a real `<a>` element with a real `href`; never put `role='link'` on a non-anchor.",
            "Accessible name comes from the visible link text; do not add `aria-label` unless the text is purely visual (an icon-only link)."
        ],
        "reducedMotion": true,
        "reviewed": true,
        "forcedColorsVerified": true,
        "reviewedNote": "2026-05-28 — Bucket-1 beta port: keyboard/ARIA contract reviewed, ForcedColors story added, Storybook axe gate (parameters.a11y.test: error)."
    },
    "tokens": {
        "colors": [
            "--color-text",
            "--color-link",
            "--color-link-hover"
        ],
        "spacing": [],
        "typography": [
            "--font-size-md"
        ]
    },
    "lightDarkVerified": true,
    "consumers": []
}
